secondary_diagnosis_id,secondary_diagnosis_code,secondary_diagnosis_desc
08f52449316c13b88080546b1f789a5b,D6c24aa,Traditional church leg argue laugh.
0cc063792df68b124a2fd6469e33cc29,D17b9aa,Participant effort whom sometimes.
4314ad859490b0089ae2138fb1638b7b,Dbd6043,Occur analysis rise process.
4eba268accd6be1068cf6461877fa505,D3256d5,Difficult reduce share.
510aa5e17d4316e9cea40bfc4b88b377,D2b9a0c,Across staff add democratic.
549846f815cce5d6bb9b3df4e7c77250,D589129,Enjoy remember suggest.
717c3ae3f2ec40bfbc84ca47fc037005,Db88a8f,Officer situation century production.
9de625d0e331926c993016b7c84bca16,Da62166,Ever area catch stock large yeah.
c2302d3ba9abd67c0d7a0b03f9acda2d,Db4a92a,Call interesting system boy.
d03f55d149faf7ecf1d9a6770bad940d,Da2673b,Professor national building.
d41d8cd98f00b204e9800998ecf8427e,,
